{
  "name": "我的全球游戏 OPC",
  "business_type": "game",
  "channels": ["app_store", "google_play", "domestic_game"],
  "data_mode": "demo",
  "reporting_currency": "CNY",
  "entities": [
    {
      "id": "cn_studio",
      "name": "中国研发运营主体",
      "tax_country": "CN",
      "functional_currency": "CNY",
      "accounting_basis": "PRC_GAAP",
      "tax_registrations": ["corporate_income_tax", "vat_general_taxpayer"]
    },
    {
      "id": "sg_publisher",
      "name": "新加坡海外发行主体",
      "tax_country": "SG",
      "functional_currency": "USD",
      "accounting_basis": "SFRS",
      "tax_registrations": ["corporate_income_tax", "gst_review_required"]
    }
  ]
}
