{
  "name": "CN NL US DTC OPC Entity-bound Connectors",
  "business_type": "commerce",
  "channels": ["dtc"],
  "integrations": ["xero", "shopify_stripe", "wise"],
  "data_mode": "demo",
  "reporting_currency": "EUR",
  "entities": [
    {
      "id": "cn_ops",
      "name": "CN 独立站 OPC 经营主体（待确认）",
      "tax_country": "CN",
      "tax_pack": "jurisdiction.cn_mainland",
      "functional_currency": "CNY",
      "accounting_basis": "PRC_GAAP",
      "fiscal_year_end": "12-31",
      "tax_registrations": []
    },
    {
      "id": "nl_sales",
      "name": "NL 独立站 OPC 经营主体（待确认）",
      "tax_country": "NL",
      "tax_pack": "jurisdiction.nl_private_limited_company",
      "functional_currency": "EUR",
      "accounting_basis": "Dutch_GAAP",
      "fiscal_year_end": "12-31",
      "tax_registrations": []
    },
    {
      "id": "us_ops",
      "name": "US 独立站 OPC 经营主体（待确认）",
      "tax_country": "US",
      "tax_pack": "jurisdiction.us_federal",
      "functional_currency": "USD",
      "accounting_basis": "US_GAAP",
      "fiscal_year_end": "12-31",
      "tax_registrations": []
    }
  ],
  "connector_bindings": [
    {
      "connector_pack": "connector.file_import",
      "entity_ids": ["cn_ops", "nl_sales", "us_ops"]
    },
    {"connector_pack": "connector.shopify", "entity_ids": ["nl_sales"]},
    {"connector_pack": "connector.stripe", "entity_ids": ["nl_sales"]},
    {"connector_pack": "connector.wise", "entity_ids": ["us_ops"]},
    {"connector_pack": "connector.xero", "entity_ids": ["cn_ops"]}
  ]
}
