{
  "name": "US WooCommerce DTC OPC",
  "business_type": "commerce",
  "channels": ["dtc"],
  "integrations": ["woocommerce"],
  "data_mode": "demo",
  "entities": [
    {
      "id": "us_dtc_company",
      "name": "US DTC company (confirm legal name)",
      "jurisdiction": "US",
      "tax_country": "US",
      "functional_currency": "USD",
      "accounting_basis": "US_GAAP",
      "fiscal_year_end": "12-31",
      "tax_registrations": []
    }
  ]
}
